{"id":"mock-large-output","category":"deterministic","description":"Mock output is capped while pipes are drained.","fixture":{"source":"."},"prompt_file":"prompt.md","verifier":{"command":"python3 verify.py","timeout_seconds":2},"agent":{"timeout_seconds":2,"required_capabilities":["edit"]},"expected":{"exit_code":0,"forbidden_side_effects":[]},"tags":["mock:large-output"]}
